pub_date	title	venue	excerpt	citation	url_slug	paper_url
2022-07-16	Staircase solutions and stability in vertically confined salt-finger convection	Journal of Fluid Mechanics (Under Review)	To be added soon	"Liu C., Julien K., Knobloch E.  (2022) ""Staircase solutions and stability in vertically confined salt-finger convection"" <i>Journal of Fluid Mechanics</i> (Under Review)"	staircase_salt_finger	https://arxiv.org/abs/2207.08029
2022-10-10	Structured input-output analysis of stably stratified plane Couette flow	Journal of Fluid Mechanics	This papers employs the recently proposed structured input-output analysis (Liu & Gayme 2021) to analyze stably stratified plane Couette flow.	"Liu C., Caulfield C.P., Gayme D.F. (2022). ""Structured input-output analysis of stably stratified plane Couette flow"" <i>Journal of Fluid Mechanics</i>. 948, A10."	SIOA_stratified_PCF	https://doi.org/10.1017/jfm.2022.648
2022-08-23	Spatial input–output analysis of actuated turbulent boundary	AIAA Journal	To be added soon	"Liu C., Gluzman I., Lozier M. Midya S., Gordeyev S., Thomas F.O., Gayme D.F. (2022) ""Spatial input–output analysis of actuated turbulent boundary"" AIAA Journal (published online)"	Spatial_IO	https://doi.org/10.2514/1.J061706
2021-11-25	Structured input-output analysis of transitional wall-bounded flows	Journal of Fluid Mechanics	"This paper is the first one to develop structured input-output analysis to analyze transitional wall-bounded shear flows. It employs a structured singular value approach to capture the componentwise structures of nonlinearity, which weakens the lift-up effect and identify streamwise varying structures close to direct numerical simulations, experiments and nonlinear optimal perturbations"	"Liu C., Gayme D.F. (2021) ""Structured input-output analysis of transitional wall-bounded flows"" <i>Journal of Fluid Mechanics</i>. 927, A25."	SIOA_transitional	https://doi.org/10.1017/jfm.2021.762
2020-04-10	An input-output based analysis of convective velocity in turbulent channels	Journal of Fluid Mechanics	To be added soon	"Liu C., Gayme D.F. (2020). ""An input-output based analysis of convective velocity in turbulent channels"" <i>Journal of Fluid Mechanics</i>. 888, A32"	convective_IO	https://doi.org/10.1017/jfm.2020.48
2020-12-28	Input-output inspired method for permissible perturbation amplitude of transitional wall-bounded shear flows	Physical Review E	To be added soon	"Liu C., Gayme D.F. (2020). ""Input-output inspired method for permissible perturbation amplitude of transitional wall-bounded shear flows"" <i>Physical Review E</i>. 102, 063108"	permissible_LMI	https://doi.org/10.1103/PhysRevE.102.063108
2020-04-01	Hydrodynamics of a flexible cylinder under modulated vortex-induced vibrations	Journal of Fluids and Structures	To be added soon	"Liu C., Fu S., Zhang M., Ren H., Xu Y. (2020). ""Hydrodynamics of a flexible cylinder under modulated vortex-induced vibrations"" <i>Journal of Fluids and Structures</i>. 94, 102913 "	VIV_modulated	https://doi.org/10.1016/j.jfluidstructs.2020.102913
2018-07-01	Time-varying hydrodynamics of a flexible riser under multi-frequency vortex-induced vibrations	Journal of Fluids and Structures	To be added soon	"Liu C., Fu S., Zhang M., Ren H. (2018). ""Time-varying hydrodynamics of a flexible riser under multi-frequency vortex-induced vibrations"" <i>Journal of Fluids and Structures</i>. 80, 217-244"	multi_freq_VIV	https://doi.org/10.1016/j.jfluidstructs.2018.03.004
